names,addresses,awb,product_id,EDD
Ted Reveal,"Anjaneya Complex, #1, Basement, HAL Old Airport Rd, Kodihalli, Bengaluru, Karnataka 560008",74446807847,SKU_142,11-02-2023
Robert Sutherland,"XJ6Q+8C4, 7th Cross Rd, Domlur I Stage, 1st Stage, Domlur, Bengaluru, Karnataka 560071",53413934431,SKU_93,12-02-2023
Clifford Jeanbaptiste,"410, 7th Cross Rd, Domlur I Stage, Stage 2, Domlur, Bengaluru, Karnataka 560071",32318569837,SKU_150,11-02-2023
James Burkett,"172B, 2nd Cross Rd, Stage 2, Indiranagar, Bengaluru, Karnataka 560071",28612109622,SKU_134,11-02-2023
Daniel Mohler,"#788, JK Plaza, 12th Main Rd, HAL 2nd Stage, Indiranagar, Bengaluru, Karnataka 560038",66220449861,SKU_3,11-02-2023
Elda Boutin,"Restaurant House, 48, Rest House Road, Off Brigade Road, Road, Bengaluru, Karnataka 560001",91881183513,SKU_89,13-02-2023
Mila Dion,"Plot No. 42, Sama Tower, Ground Floor, Church Street, Bengaluru, Karnataka 560001",24528650160,SKU_135,12-02-2023
Melia Eichmann,"Church St, Haridevpur, Shanthala Nagar, Ashok Nagar, Bengaluru, Karnataka 560001",33745024949,SKU_126,11-02-2023
Earl Pollara,"No. 20, 2nd Floor, Paul Castle, Castle St, near Brigade Tower, Ashok Nagar, Bengaluru, Karnataka 560025",64667212744,SKU_31,11-02-2023
Ida Vanderlinde,"282-285, Intermediate Ring Rd, Krishna Reddy Layout, Amarjyoti Layout, Domlur, Bengaluru, Karnataka 560071",26150642532,SKU_30,13-02-2023
James Byron,"Ground Floor, 608, 12th Main Rd, HAL 2nd Stage, Indiranagar, Bengaluru, Karnataka 560038",15524752967,SKU_146,13-02-2023
Annette Russell,"XJ95+R23, Markham Rd, Shanthala Nagar, Ashok Nagar, Bengaluru, Karnataka 560025",12584409519,SKU_55,11-02-2023
Michael Adams,"5 Lancer Building, 120, Brigade Rd, Ashok Nagar, Bengaluru, Karnataka 560025",79440976227,SKU_150,11-02-2023
Linda Warner,"172B, 2nd Cross Rd, Stage 2, Indiranagar, Bengaluru, Karnataka 560071",93533947856,SKU_77,12-02-2023
Christina Mcghee,"Building No, 1314, Paramahansa Yogananda Rd, Indira Nagar II Stage, Eshwara Layout, Indiranagar, Bengaluru, Karnataka 560038",47965414193,SKU_118,13-02-2023
Anthony Hofer,"Allied Grand Plaza, 3rd, 8, Magrath Rd, Ashok Nagar, Bengaluru, Karnataka 560025",25027698252,SKU_28,11-02-2023
Juan Guzman,"138/28, Off, Intermediate Ring Rd, opposite Embassy Golf Links, Krishna Reddy Layout, Amarjyoti Layout, Domlur, Bengaluru, Karnataka 560071",91425776426,SKU_89,13-02-2023
Irene Harris,"entrance corner, No. 31, 1st Floor, SGR Junction 7th Cross Rd, 4th Main Rd, 1st Stage, Domlur, Bengaluru, Karnataka 560071",41659166589,SKU_84,11-02-2023
Elizabeth Robbins,"2981, Icon Mall, Ground Floor, 12th main, 5th Cross Rd, HAL 2nd Stage, Indiranagar, Bengaluru, Karnataka 560038",14333458585,SKU_104,11-02-2023
Dianne Edge,"The Park, MG Road, 14/7, Bhaskaran Rd, Sivanchetti Gardens, Bengaluru, Karnataka 560042",48175097048,SKU_68,13-02-2023
Martha Blackaby,"No.949, 12th Main Rd, Sodepur, Appareddipalya, Indiranagar, Bengaluru, Karnataka 560008",80006755613,SKU_69,13-02-2023
Margaret Hunstad,"Public Utility Building, 36 1, Mahatma Gandhi Rd, Halasuru, Karnataka 560001",96709522045,SKU_26,12-02-2023
Jacqueline Cockrell,"No 325, Mahatma Gandhi Rd, Haridevpur, Shanthala Nagar, Shivaji Nagar, Bengaluru, Karnataka 560001",86821532481,SKU_38,11-02-2023
Paul Price,"No. 3115, East West Apartment, 13th Cross, Indiranagar 2nd Stage, Near ESI Hospital, Bengaluru, Karnataka 560038",74129338785,SKU_145,12-02-2023
Maureen English,"693,, 17th E Cross Rd, Chinmaya Mission Hospital Rd, laksmipuram, Indiranagar, Bengaluru, Karnataka 560038",34155006971,SKU_38,11-02-2023
Karen Zayicek,"3, Ground Floor House of Lords, St Mark's Rd, Bengaluru, Karnataka 560001",44832974738,SKU_4,11-02-2023
William Miller,"Telephone Exchange Near, No-473, 80 Feet Rd, HAL 3rd Stage, Beema Nagar, Indiranagar, Bengaluru, Karnataka 560075",39021592852,SKU_61,11-02-2023
Basil Ryan,"24, Church St, Shanthala Nagar, Ashok Nagar, Bengaluru, Karnataka 560001",87335767127,SKU_109,12-02-2023
Samuel Fernandez,"Fifth Floor, 1 MG Mall, Old Madras Rd, Halasuru, Someshwarpura, Karnataka 560001",97870332834,SKU_41,12-02-2023
Peter Banks,"421R, Shri Krishna Temple Rd, Indira Nagar 1st Stage, Stage 1, Indiranagar, Bengaluru, Karnataka 560038",30241024803,SKU_109,11-02-2023
Lisa Mckown,"nd stage, #4062, 19th A Main Rd, behind Carlton Towers, HAL 2nd Stage, HAL, Bengaluru, Karnataka 560008",50118634064,SKU_58,11-02-2023
Omar Schiavone,"Ashok Nagar, Bengaluru, Karnataka 560025",98498251405,SKU_41,11-02-2023
Samuel Oconnell,"No 325, Mahatma Gandhi Rd, Haridevpur, Shanthala Nagar, Shivaji Nagar, Bengaluru, Karnataka 560001",40898512069,SKU_60,13-02-2023
Toby Burgos,"No. 30, Residency Road Brigade Road - Residency Road, Junction, Ashok Nagar, Bengaluru, Karnataka 560025",40296979277,SKU_92,13-02-2023
Edward Mcdonough,"Ashok Nagar, Bengaluru, Karnataka 560025",94864525548,SKU_42,13-02-2023
Elizabeth Fairfield,"2nd floor, 33, Church St, Above Mainland China, Shanthi Nagar, Ashok Nagar, Bengaluru, Karnataka 560001",36008428431,SKU_21,11-02-2023
Janette Williams,"Shop no. 216-219, 2th Floor, Forum Neighbourhood Mall, No 62, Whitefield, Bengaluru, Karnataka 560066",57407525162,SKU_127,12-02-2023
Katherine Corbitt,"101, Brigade Rd, Below ICP, Shanthala Nagar, Ashok Nagar, Bengaluru, Karnataka 560025",53203215625,SKU_89,12-02-2023
Katherine Fields,"545, Chinmaya Mission Hospital Road, Binnamangala, Indiranagar, Bengaluru, Karnataka 560038",12480146452,SKU_105,11-02-2023
Susan Harris,"34, Rest House Rd, Shanthala Nagar, Sampangi Rama Nagara, Bengaluru, Karnataka 560001",12094215863,SKU_66,12-02-2023
Steven Caballero,"XJ2V+22R, Embassy Golf Links Business Park, Challaghatta, Bengaluru, Karnataka 560071",49390409704,SKU_118,12-02-2023
Larry Hall,"Brigade Rd, opp. St Joseph commerce College, Shanthala Nagar, Ashok Nagar, Bengaluru, Karnataka 560001",64640288733,SKU_59,11-02-2023
Bobby Mercado,"XJG3+554, Church St, Haridevpur, Shanthala Nagar, Ashok Nagar, Bengaluru, Karnataka 560001",26676603358,SKU_50,13-02-2023
Doris Lawhorn,"35, Castle St, Ashok Nagar, Bengaluru, Karnataka 560025",67009808160,SKU_67,12-02-2023
George Polycarpe,"120, Brigade Road, 4th Floor, Lancer Building, Ashok Nagar, Bengaluru, Karnataka 560025",38936179254,SKU_10,11-02-2023
Joel Cowan,"7/A, 1st KM Complex, Kodihalli Main Rd, Bengaluru, Karnataka 560008",75789739890,SKU_36,13-02-2023
Gladys Guertin,"XJJR+268, 5th Main Rd, Indira Nagar II Stage, Hoysala Nagar, Indiranagar, Bengaluru, Karnataka 560038",54451469473,SKU_60,11-02-2023
Glenna Perry,"322/1, Chinmaya Mission Hospital Rd, Near Indiranagar Metro Station, Binnamangala, Stage 1, Indiranagar, Bengaluru, Karnataka 560038",56028013291,SKU_101,11-02-2023
David Farrey,"1079, 12th Main Rd, Appareddipalya, Indiranagar, Bengaluru, Karnataka 560008",94742595294,SKU_119,12-02-2023
Hazel Martin,"1MG, 2nd Floor, Lido Mall Trinity Circle, Mahatma Gandhi Rd, opposite Taj Vivanta, Bengaluru, Karnataka 560008",68650384198,SKU_105,12-02-2023
April Sumner,"Ground Floor & 1st Floor, Brigade Rd, opposite Space Centre, Shanthala Nagar, Ashok Nagar, Bengaluru, Karnataka 560029",75514322127,SKU_148,11-02-2023
Martha Sellers,"236, 13th Cross Rd, Indira Nagar II Stage, Hoysala Nagar, Indiranagar, Bengaluru, Karnataka 560038",23322221647,SKU_110,13-02-2023
Latoya Waller,"Todi Residency, Coffee Day, 57, 100 Feet Rd, next to Cafe, Indiranagar, Bengaluru, Karnataka 560038",12587871983,SKU_11,12-02-2023
Otis Butterworth,"37-39, Mahatma Gandhi Rd, Yellappa Garden, Yellappa Chetty Layout, Sivanchetti Gardens, Bengaluru, Karnataka 560001",82001092315,SKU_60,12-02-2023
Todd Howard,"52, Mahatma Gandhi Rd, Haridevpur, Shanthala Nagar, Shivaji Nagar, Bengaluru, Karnataka 560001",35290026057,SKU_32,11-02-2023
Florence Davis,"2nd floor, 33, Church St, Above Mainland China, Shanthi Nagar, Ashok Nagar, Bengaluru, Karnataka 560001",46793409626,SKU_19,12-02-2023
Bob Douglass,"3rd Floor, 8th Main Road, 710, 80 Feet Rd, above New Bata Showroom, Indiranagar, Bengaluru, Karnataka 560038",24024754041,SKU_130,11-02-2023
Stephanie Sullivan,"No.840/1, 100 ft road, Metro Pillar 56 & 57, Indiranagar, Bengaluru, Karnataka 560038",85497713967,SKU_20,11-02-2023
Amos Sexton,"XJC4+GPP, Brigade Rd, Haridevpur, Shanthala Nagar, Ashok Nagar, Bengaluru, Karnataka 560001",37241712280,SKU_139,11-02-2023
Sharon Gateley,"XJMR+45P, Near-Kotak Mahendra Bank, 100 Feet Rd, Indira Nagar II Stage, Hoysala Nagar, Indiranagar, Bengaluru, Karnataka 560038",29227645181,SKU_5,12-02-2023
Nancy Hollie,"1/4, Ground Floor, 1 Mg-Lido Mall, Old Madras Rd, Halasuru, Bengaluru, Karnataka 560008",69351102415,SKU_122,11-02-2023
Harry Medina,"1st floor, 765, 100 Feet Rd, HAL 2nd Stage, Appareddipalya, Indiranagar, Bengaluru, Karnataka 560038",83986865302,SKU_112,11-02-2023
Maura Bland,"Ram Kunj, 16/3, Magrath Rd, Opposite Garuda Mall, Ashok Nagar, Bengaluru, Karnataka 560025",12427578509,SKU_77,11-02-2023
Pauline Bacon,"Church St 46/1, Cobalt, Haridevpur, Shanthala Nagar, Ashok Nagar, Bengaluru, Karnataka 560001",81526509059,SKU_100,13-02-2023
Imogene Johnson,"13th, 3136, 7th cross, main, Shirdi Sai Baba Mandir Rd, Indiranagar, Bengaluru, Karnataka 560038",41646112349,SKU_39,12-02-2023
Charles Metzger,"WJ52+29G, Dollar Layout, Stage 2, BTM Layout, Bengaluru, Karnataka 560076",95972400970,SKU_113,12-02-2023
Marcia Guerra,"Brigade Rd, opp. St Joseph commerce College, Shanthala Nagar, Ashok Nagar, Bengaluru, Karnataka 560001",56866279932,SKU_51,11-02-2023
Charlie Prost,"185, Brigade Rd, next to Piza Hut, Shanthala Nagar, Ashok Nagar, Bengaluru, Karnataka 560001",75279862918,SKU_56,11-02-2023
Mabel Loiseau,"86, Church Street spencer building, Mahatma Gandhi Rd, Bengaluru, Karnataka 560001",68028364648,SKU_76,11-02-2023
Brandon Jameson,"1083, Rooftop, Prince Arcade, 12th Main Rd, HAL 2nd Stage, Indiranagar, Bengaluru, Karnataka 560038",35407564231,SKU_142,12-02-2023
Wanda Harris,"185, Brigade Rd, next to Piza Hut, Shanthala Nagar, Ashok Nagar, Bengaluru, Karnataka 560001",12254476512,SKU_135,11-02-2023
Shakia Hartman,"No.169, 13th Main Rd, HAL 2nd Stage, Indiranagar, Bengaluru, Karnataka 560008",15162277692,SKU_133,11-02-2023
Amanda Witcher,"1136, 100 Feet Rd, HAL 2nd Stage, Indiranagar, Bengaluru, Karnataka 560008",24073999831,SKU_88,12-02-2023
David Kroesing,"Brigade Rd, Shanthala Nagar, Ashok Nagar, Bengaluru, Karnataka 560001",36089993310,SKU_20,11-02-2023
Mary Olivares,"204, 5th Main Rd, 7th Cross, Binnamangala, Stage 1, Indiranagar, Bengaluru, Karnataka 560038",90551624080,SKU_93,11-02-2023
William Cunningham,"No. 2/1, Brunton Road, Off MG Road, Opp Old Passport Office, Bengaluru, Karnataka 560001",66989379394,SKU_25,11-02-2023
Robert Livengood,"4-9, Brigade Rd, Shanthala Nagar, Ashok Nagar, Bengaluru, Karnataka 560025",96634390228,SKU_4,11-02-2023
Lorraine Martinez,"No:141, 4th Floor, Junction, Thanisandra Main Road, Above A2B, Nagavara, Bengaluru, Karnataka 560045",87738619330,SKU_50,13-02-2023
Mary Hull,"18, Church St, Shanthala Nagar, Ashok Nagar, Bengaluru, Karnataka 560001",52161100850,SKU_123,13-02-2023
Leila Weaver,"70, Brigade Rd, Ashok Nagar, Bengaluru, Karnataka 560025",19687202894,SKU_72,12-02-2023
Jimmie Goodrum,"No 10 floor, Curzon Court Complex, Brigade Rd, 1st R Block, Shanthala Nagar, Ashok Nagar, Bengaluru, Karnataka 560001",18586870335,SKU_107,13-02-2023
David Radice,"1200, 100 Feet Rd, HAL 2nd Stage, Doopanahalli, Indiranagar, Bengaluru, Karnataka 560008",24495277697,SKU_104,12-02-2023
Elizabeth Ellis,"XJJQ+VJR, 2nd Main Rd, Binnamangala, Stage 1, Indiranagar, Bengaluru, Karnataka 560038",17136896234,SKU_27,11-02-2023
Mildred Burns,"2nd Floor, #295-296, 100 Feet Rd, First Stage, Indiranagar, Bengaluru, Karnataka 560038",69900608352,SKU_60,11-02-2023
Forrest Ames,"M G, The Oberoi Bengaluru, 37-39, Mahatma Gandhi Road, Road, Bengaluru, Karnataka 560001",58190771447,SKU_45,11-02-2023
Anthony Rivera,"Trinity Circle, 1 Mg 1 Mg-Lido Mall, Foodhall, 1, Mahatma Gandhi Rd, Bengaluru, Karnataka 560008",41996893111,SKU_89,12-02-2023
Marla Miller,"MSK Plaza, 3rd Main Rd, Defence Colony, Indiranagar, Bengaluru, Karnataka 560038",97089621557,SKU_15,13-02-2023
Sandra Madden,"32, Ground Floor, Gurudev Chambers, 7th Cross Rd, First Stage, Indiranagar, Bengaluru, Karnataka 560038",46902023822,SKU_30,12-02-2023
Rebecca Anderson,"5th Floor, Bangalore Central Mall, Residency Rd, Bengaluru, Karnataka 560025",75441819321,SKU_17,11-02-2023
Katherine Brown,"#294, 6th Main, HAL 2nd Stage, Near Ezone, Indiranagar, Bengaluru, Karnataka 560008",28286106337,SKU_143,12-02-2023
Virgil Dudley,"No.1, 17e, Chinmaya Mission Hospital Rd, 2nd stage Indiranagar, BDA Colony, Domlur Village, Indiranagar, Bengaluru, Karnataka 560008",19424965508,SKU_65,11-02-2023
Brittany Hale,"6, Rest House Rd, Shanthala Nagar, Ashok Nagar, Bengaluru, Karnataka 560001",22789904921,SKU_93,12-02-2023
Mark Strobel,"H.No: 191 VINAYAKA PG Near Nagarjuna Hotel, beside KIWI DATES AND NUTS B, Karnataka 560038",78559720051,SKU_137,11-02-2023
Monica Allen,"6, 2, Primrose Rd, Craig Park Layout, Sivanchetti Gardens, Bengaluru, Karnataka 560025",64683788121,SKU_30,13-02-2023
Stanley Chisolm,"1MG, 2nd Floor, Lido Mall Trinity Circle, Mahatma Gandhi Rd, opposite Taj Vivanta, Bengaluru, Karnataka 560008",22776490886,SKU_63,13-02-2023
Shirley Cason,"21/A, nr. Honda Service Center, K.R.Colony, Krishna Reddy Layout, Domlur, Bengaluru, Karnataka 560071",86965274534,SKU_63,12-02-2023
Jettie Bergevin,"No 148 & 149, St Thomas Building, Brigade Rd, Shanthala Nagar, Ashok Nagar, Karnataka 560025",88031625743,SKU_103,11-02-2023
James Wayman,"No 479 , 1st Floor, 2nd Main, behind BDA Complex, 2nd Stage, Indiranagar, Bengaluru, Karnataka 560038",28422017792,SKU_45,12-02-2023
Irene Chivers,"1, 1, Museum Rd, Haridevpur, Shanthala Nagar, Ashok Nagar, Bengaluru, Karnataka 560001",44427217462,SKU_32,11-02-2023
Warren Lamb,"Ashok Nagar, Bengaluru, Karnataka 560025",96818139553,SKU_70,11-02-2023
Ericka Breeden,"Maharaja Furniture Building, 1205, 100 Feet Rd, HAL 2nd Stage, Doopanahalli, Indiranagar, Bengaluru, Karnataka 560008",81050330436,SKU_124,11-02-2023
Lynnette Pinero,"Brigade Road,Opposite Brigade Towers, Plot No. 124, Near Vellara Junction, Bengaluru, Karnataka 560050",75614896303,SKU_114,11-02-2023
Jennifer Dobson,"No 1, 1A, Chinmaya Mission Hospital Rd, Stage 1, Indiranagar, Bengaluru, Karnataka 560038",26547492470,SKU_120,12-02-2023
Ruth Cuevas,"1st floor, #57, 100 Feet Rd, above Hush Puppies showroom, Defence Colony, Indiranagar, Bengaluru, Karnataka 560038",47296845147,SKU_19,12-02-2023
Kevin Miller,"XJ8Q+286, 1st Main Rd, Stage 2, Domlur, Bengaluru, Karnataka 560008",50285248167,SKU_85,11-02-2023
Janice Dartt,"Shop No, 763, 100 Feet Rd, next to Xtreme Sports Bar, HAL 2nd Stage, Appareddipalya, Indiranagar, Bengaluru, Karnataka 560038",23210809663,SKU_66,11-02-2023
Ernest Ragan,"2286, 14th A Main Rd, HAL 2nd Stage, Indiranagar, Bengaluru, Karnataka 560038",16360780825,SKU_144,11-02-2023
Victor Norcross,"No1, Brunton Rd, Ashok Nagar, Bengaluru, Karnataka 560025",61101038477,SKU_109,11-02-2023
Robert Mirabella,"HAL 2nd Stage, Doopanahalli, Indiranagar, Bengaluru, Karnataka 560008",23264212481,SKU_73,11-02-2023
Carmen Brussel,"Shop No. 26, HAL Old Airport Rd, ISRO Colony, Domlur, Bengaluru, Karnataka 560008",64077851616,SKU_95,11-02-2023
David Chisolm,"H.No: 191 VINAYAKA PG Near Nagarjuna Hotel, beside KIWI DATES AND NUTS B, Karnataka 560038",23206308189,SKU_32,11-02-2023
Gary Yates,"18, 17th F Cross Road, Hoysala Nagar, Indiranagar, Bengaluru, Karnataka 560038",23987063003,SKU_98,13-02-2023
Arthur Brookes,"50/1, Church St, Shanthala Nagar, Ashok Nagar, Bengaluru, Karnataka 560001",89129483649,SKU_81,13-02-2023
Amy Peterson,"1st floor, #57, 100 Feet Rd, above Hush Puppies showroom, Defence Colony, Indiranagar, Bengaluru, Karnataka 560038",85673431434,SKU_32,11-02-2023
Hong Hiser,"Allied Grand Plaza, 2nd Floor, 8, Magrath Rd, Above Nalli Silks, Opposite Garuda Mall, Ashok Nagar, Bengaluru, Karnataka 560025",46540900563,SKU_5,13-02-2023
Mary Brown,"303, Ashoka Terrace, 5th Main Rd, Indira Nagar 1st Stage, Bengaluru, Karnataka 560038",22713075190,SKU_117,11-02-2023
Arthur Wood,"Shop No, 763, 100 Feet Rd, next to Xtreme Sports Bar, HAL 2nd Stage, Appareddipalya, Indiranagar, Bengaluru, Karnataka 560038",48417748072,SKU_106,13-02-2023
Marion Pollard,"2986, 12th Main Rd, HAL 2nd Stage, Indiranagar, Bengaluru, Karnataka 560038",45024955169,SKU_43,11-02-2023
Joseph Sirmons,"Sri Avenue.23, 3rd B Cross, 60 feet, 12th Cross Rd, 2nd Stage, Domlur, Bengaluru, 560008",67836966420,SKU_30,13-02-2023
Raymond Curry,"The Park, MG Road, 14/7, Bhaskaran Rd, Sivanchetti Gardens, Bengaluru, Karnataka 560042",16748687433,SKU_80,12-02-2023
Shirley Maxwell,"Tower-B, 13th Floor, 84, Mahatma Gandhi Rd, Bengaluru, Karnataka 560001",94940403603,SKU_37,11-02-2023
Charley Marshall,"21/A, nr. Honda Service Center, K.R.Colony, Krishna Reddy Layout, Domlur, Bengaluru, Karnataka 560071",55069433033,SKU_24,11-02-2023
Rodney Grimes,"XJ2Q+WXH, 100 Feet Rd, Krishna Reddy Layout, Amarjyoti Layout, Domlur, Bengaluru, Karnataka 560071",46644684687,SKU_15,11-02-2023
Nicholas Meese,"#79,Ground Floor, 2nd Cross Rd, 2nd Phase, J. P. Nagar, Bengaluru, Karnataka 560078",21368508152,SKU_137,13-02-2023
William Hacher,"14, Church St, Shanthala Nagar, Ashok Nagar, Bengaluru, Karnataka 560001",16270368177,SKU_9,13-02-2023
Kathleen Galvan,"22, Near George Thangayya Complex, 80 Feet Rd, Michael Palaya, Defence Colony, Indiranagar, Bengaluru, Karnataka 560075",21747185042,SKU_38,13-02-2023
Nicole Blair,"#79,Ground Floor, 2nd Cross Rd, 2nd Phase, J. P. Nagar, Bengaluru, Karnataka 560078",98357415751,SKU_74,13-02-2023
Keisha Farnham,"2985, 12th Main Rd, HAL 2nd Stage, Indiranagar, Bengaluru, Karnataka 560038",17845278009,SKU_86,13-02-2023
Heidi Thomas,"The Oberoi, 37-39, Mahatma Gandhi Rd, Yellappa Garden, Yellappa Chetty Layout, Sivanchetti Gardens, Bengaluru, Karnataka 560001",35896375109,SKU_14,13-02-2023
Jennifer Thompson,"477, Shri Krishna Temple Rd, Near Karnataka Bank, Indira Nagar 1st Stage, Stage 1, Indiranagar, Bengaluru, Karnataka 560038",47419445921,SKU_24,11-02-2023
Gerald Mcdaniel,"37-39, Mahatma Gandhi Rd, Yellappa Garden, Yellappa Chetty Layout, Sivanchetti Gardens, Bengaluru, Karnataka 560001",12626058017,SKU_47,11-02-2023
Richard Woods,"Building No, 1314, Paramahansa Yogananda Rd, Indira Nagar II Stage, Eshwara Layout, Indiranagar, Bengaluru, Karnataka 560038",32597766719,SKU_15,13-02-2023
Adrian Brower,"Level 5, Mall, 1, Mahatma Gandhi Rd, Halasuru, Someshwarpura, Bengaluru, Karnataka 560001",86110945269,SKU_105,11-02-2023
Luis Marshal,"311, 1st Floor, 100 Feet Rd, Indira Nagar 1st Stage, Stage 1, Indiranagar, Bengaluru, Karnataka 560038",55663362620,SKU_130,13-02-2023
Andria Hembree,"XJ94+8GG, Castle St, Ashok Nagar, Bengaluru, Karnataka 560025",41180726272,SKU_57,11-02-2023
Antonetta Lucas,"322, Chinmaya Mission Hospital Rd, Binnamangala, Stage 1, Indiranagar, Bengaluru, Karnataka 560038",79190296641,SKU_80,11-02-2023
Janelle Donovan,"24, Church St, Shanthala Nagar, Ashok Nagar, Bengaluru, Karnataka 560001",24675148312,SKU_92,11-02-2023
Jane Hong,"6, 2nd Main Rd, First Stage, Defence Colony, Indiranagar, Bengaluru, Karnataka 560038",22445584311,SKU_25,11-02-2023
Marsha Rozzi,"XJGW+3RH, 80 Feet Rd, HAL 3rd Stage, Indiranagar, Bengaluru, Karnataka 560075",22248774308,SKU_89,13-02-2023
Steven Hall,"#294, 6th Main, HAL 2nd Stage, Near Ezone, Indiranagar, Bengaluru, Karnataka 560008",58511322198,SKU_1,11-02-2023
Leonard Corrigan,"No.9/7 ground floor, new ring road, 2nd Main Rd, Domlur, Bengaluru, Karnataka 560071",77355269627,SKU_59,11-02-2023
Steven Garrison,"1MG, 2nd Floor, Lido Mall Trinity Circle, Mahatma Gandhi Rd, opposite Taj Vivanta, Bengaluru, Karnataka 560008",11998904441,SKU_21,11-02-2023
