names,addresses,awb,product_id,EDD
Tammy Sampson,"Near Munekolala bus Stand, behind Laxmi Narayan Temple, Bengaluru, Karnataka 560037",41460534932,SKU_141,11-02-2023
Katrina Stratter,"4th floor, Park Square Mall, Whitefield Main Rd, Pattandur Agrahara, Bengaluru, Karnataka 560066",58671386654,SKU_69,12-02-2023
Renee Zuniga,"Level 3, Marathahalli Village, Marathahalli, Bengaluru, Karnataka 560037",24977608651,SKU_38,13-02-2023
Dale Jackson,"XMGW+6MW, Doddanakundi Village Outer Ring Road,KR Puram,Hobli, Brindavan Extension, Doddanekundi, Bengaluru, Karnataka 560037",99084254555,SKU_96,11-02-2023
Florence Powell,"9, Sai Baba Temple Rd, Silver Springs Layout, Munnekollal, Bengaluru, Karnataka 560037",28429223295,SKU_47,12-02-2023
Doreen Rosales,"Vaswani Pinnacle Annexe, Whitefield Main Rd, Whitefield, Sathya Sai Layout, Bengaluru, Karnataka 560066",68070405533,SKU_56,13-02-2023
Nathan Stephens,"57/1, udaya Bulding, JK mall, post, Whitefield, Bengaluru, Karnataka 560066",21156149257,SKU_99,13-02-2023
William Gilbert,"NTR Royal Plaza, 89/1, N Thimmareddy Building, road, Marathahalli Village, Marathahalli, Bengaluru, Karnataka 560037",64239330837,SKU_61,11-02-2023
Keiko Jackson,"Borewell Rd, Phase 1, Palm Meadows, Bengaluru, Karnataka 560066",57393556365,SKU_48,11-02-2023
John Meyers,"20/5, Panathur Junction, Outer Ring Road, Kaverappa Layout, Marathahalli, East Bangalore, Bengaluru, Karnataka 560103",87189120582,SKU_96,12-02-2023
Renato Kennedy,"NTR Royal Plaza, 4th Floor,Home, Outer Ring Rd, Marathahalli, Bengaluru, Karnataka 560037",42325476681,SKU_122,11-02-2023
Jennifer Campbell,"Nagondanahalli Main Rd, Nagondanahalli, Bengaluru, Karnataka 560067",63811310290,SKU_135,11-02-2023
Eunice Matz,"Novotel Bengaluru Outer Ring Road, Opp. RMZ Eco-space Business Park, Marathahalli - Sarjapur Outer Ring Rd, Bengaluru, Karnataka 560103",65855704350,SKU_31,13-02-2023
Brandon Stevens,"and Columbia Asia Hospital, Sigma Soft Tech Park, Ground Floor open area near Alpha Tower No.7, Whitefield Main Road, Varthur Kodi, Whitefield Opp to LG Show Room, and, adjacent to ALPHA, Bengaluru, Karnataka 560066",95040388101,SKU_86,13-02-2023
Marilyn Jones,"203, Whitefield Main Rd, Whitefield, Sathya Sai Layout, Bengaluru, Karnataka 560066",62723500000,SKU_67,11-02-2023
Richard Bauman,"Plot No. S3 & S4, Silver Spring Layout, Spice Garden Compound, Marathalli Bridge, Spice Garden Layout, Lakshminarayana Pura, Munnekollal, Bengaluru, Karnataka 560037",57378708509,SKU_144,11-02-2023
Savannah Steele,"57/1, udaya Bulding, JK mall, post, Whitefield, Bengaluru, Karnataka 560066",59069863801,SKU_26,13-02-2023
Kathleen Allain,"64, SH 35, Whitefield, Phase 2, Narayanappa Garden, Bengaluru, Karnataka 560066",83081649494,SKU_96,13-02-2023
Juan Schofield,"Shop No.4, S.H.R. Complex, Siddhapura, Varthur Rd, Whitefield, Bengaluru, Karnataka 560066",62665068155,SKU_109,12-02-2023
Shawnda Mercado,"84/1, Near Vasvani Reserve, Opp. SBI Bank, Kadubeesanahalli, Panathur Main Road, Marathahalli, Bangalore, Bengaluru, Karnataka 560103",76015075032,SKU_9,12-02-2023
Roger Conwell,"Novotel Bengaluru Outer Ring Road, Opp. RMZ Eco-space Business Park, Marathahalli - Sarjapur Outer Ring Rd, Bengaluru, Karnataka 560103",27417889703,SKU_59,11-02-2023
Woodrow Smith,"ITPL Main Rd, Whitefield, KIADB Export Promotion Industrial Area, Krishnarajapura, Bengaluru, Karnataka 560066",17214257537,SKU_58,12-02-2023
Jean Bryant,"10/3, Devarabeesanahali, Outer Ring Road,, Opposite Embassy Tech Village(near Horizon College of Engineering),, Marathahalli Outer ring road, Bengaluru-560103, Bengaluru, Karnataka 560103",54161859066,SKU_125,13-02-2023
Isabel Wade,"XQH2+XWH, Dr Ambedkar Nagar Rd, Whitefield, Ambedkar Nagar, Bengaluru, Karnataka 560066",98562360039,SKU_14,11-02-2023
Bonita Anderson,"ASK Tower, ITPL Main Rd, Lakshminarayana Pura, BEML Layout, Brookefield, Bengaluru, Karnataka 560037",74877084061,SKU_131,12-02-2023
Rosa Roth,"# 17/1, 1st floor, Hosur Road, Richmond Town, (Opp to Fathima Bakery - Johnson market), Bengaluru, Karnataka 560025",72517464940,SKU_35,12-02-2023
Kirk Meja,"Prestige Shantiniketan, Hoodi, Whitefield, Bengaluru, Karnataka 560048",57364902760,SKU_49,12-02-2023
Annie Pfeifer,"1st cross, village, Whitefield, Siddapura, Bengaluru, Karnataka 560066",21482144519,SKU_61,11-02-2023
Ann Lawson,"Star Extra Mall, Tata Star Extra, Opposite Shankara Eye Hospital, Kundalahalli Gate, Varthur Rd, Marathahalli, Bengaluru, Karnataka 560037",71057404139,SKU_142,11-02-2023
Kevin Robles,"704, Opp laughing Water, Next to BBMP ofice and Tansi Honda Showroom, Whitefield, Ramagondanahalli, Bengaluru, Karnataka 560066",69736888549,SKU_47,12-02-2023
John Marino,"No:4, Basavanagar Main Rd, near State bank of India, Talacauvery Housing Society Layout, Basavanagara, Bengaluru, Karnataka 560037",85253215850,SKU_148,11-02-2023
Cynthia Bermudez,"573, Nagappa Reddy Layout Rd, Lakshminarayana Pura, AECS Layout, Marathahalli, Bengaluru, Karnataka 560037",28684838258,SKU_44,12-02-2023
Rita Patrylak,"23/4, Kariyammana Agrahara Rd, Kadubeesanahalli, Marathahalli, Bengaluru, Karnataka 560037",82484395314,SKU_81,11-02-2023
Lonny Peltier,"06, Ground Floor, Forum Neighborhood Mall, Varthur Rd, Whitefield, Prestige Ozone, Bengaluru, Karnataka 560066",85599207758,SKU_54,11-02-2023
Danny Holloman,"Lemon Tree Hotel, 23, EPIP Zone Whitefield Rd, Whitefield, Kundalahalli, Brookefield, Bengaluru, Karnataka 560066",82880222948,SKU_107,13-02-2023
Christoper Engfer,"4034, 100 Feet Road, HAL 2nd Stage, Indira Nagar, Opposite Domlur Flyover, Bengaluru, Karnataka 560038",37000925033,SKU_98,11-02-2023
Rodney Phillips,"XP5J+PQQ, Opposite Devagiri Pearls, Rd, Whitefield, Siddapura, Bengaluru, Karnataka 560066",17845901059,SKU_103,11-02-2023
Joseph Keel,"XPHH+GCG, Inorbit Mall, Whitefield, KIADB Export Promotion Industrial Area, Bengaluru, Karnataka 560066",31416355941,SKU_30,13-02-2023
Christopher Hoffman,"3rd cross, Chinnapanahalli Main Rd, Kundalahalli Colony, Brookefield, Bengaluru, Karnataka 560037",85435386822,SKU_67,12-02-2023
Valeria Osborne,"2, 8th Main Rd, KHB Block Koramangala, Koramangala 4-B Block, Koramangala 4th Block, Koramangala, Bengaluru, Karnataka 560034",85915988468,SKU_88,13-02-2023
Jackson Babb,"2nd Floor, Srirama Arcade, Whitefield Main Rd, Thubarahalli, Bengaluru, Karnataka 560066",21817570559,SKU_31,12-02-2023
Erin Bennett,"Between 7th and, Opposite Salarpuria supreme back gate Tulasi Theatre Road, 8th Main Rd, Marathahalli Village, Marathahalli, Bengaluru, Karnataka 560037",85240302205,SKU_58,13-02-2023
Wendy Cantu,"My break food court,concourse building,itpl,whitefield, Bengaluru, Karnataka 560066",87258997693,SKU_2,12-02-2023
Karen Castellanos,"No. 7, Property No. 07, , White Field,Cmc Ward No. 1 Cmc, 5/5, Whitefield Main Rd, Whitefield, Bengaluru, Karnataka 560066",14155204080,SKU_44,13-02-2023
Charlotte Parks,"7/1, ITPL Main Rd, BEML Layout, Brookefield, Bengaluru, Karnataka 560066",82238651661,SKU_6,11-02-2023
Ruth Shulda,"No. 18, Ramakka Building, Ground Floor, Mylsandra Main Road, Near, Global Village Rd, Back Gate, Bengaluru, Karnataka 560059",96667402226,SKU_99,12-02-2023
Maria Crouch,"Shop No 1, Ground floor, Suchitra Arcade, munnekolala, 1st Cross Rd, Marathahalli, Bengaluru, Karnataka 560037",68189056656,SKU_145,13-02-2023
Dan Stone,"Kanti Sweets No. 518, V V Arcade, 1st Main Road, AECS Layout, ITPL Main Rd, B Block, Kundalahalli, Brookefield, Bengaluru, Karnataka 560037",16530558744,SKU_27,11-02-2023
Carol Killough,"#37, SGR Dental College Rd, Maruthi Layout, Kasavanahalli Village, Marathahalli, Bengaluru, Karnataka 560037",41628138072,SKU_81,11-02-2023
Aaron Johnson,"opp. innovative multiplex, CKB Layout, Chandra Layout, Marathahalli, Bengaluru, Karnataka 560073",67201502727,SKU_145,11-02-2023
Karen Scott,"Govt High School, Hagadur Main Rd, opp. Immadihalli, Whitefield, Immadihalli, Bengaluru, Karnataka 560066",24206358538,SKU_60,11-02-2023
Roberto Weaver,"Shop No. 4, Chetan Building, SH 35, opposite St. Joseph Convent School, Whitefield, Sathya Sai Layout, Bengaluru, Karnataka 560066",28743315320,SKU_85,11-02-2023
Julia Gilliam,"The Zuri The Zuri Hotel Building, The Zuri Hotel, Lobby Level, ITPL Road, Whitefield, Bangalore, Whitefield, East Bangalore, Bengaluru, Karnataka 560066",32096807787,SKU_16,11-02-2023
Elizabeth Osofsky,"RMZ Ecoworld Rd, Adarsh Palm Retreat, Bellandur, Bengaluru, Karnataka 560103",75417077239,SKU_113,12-02-2023
Carolyn Kirk,"#3 Roma patria building, near Bank of, B Block, AECS Layout, Brookefield, Bengaluru, Karnataka 560037",56066451507,SKU_81,12-02-2023
Concetta King,"1576A, 4th Main Rd, E Block, AECS Layout, Marathahalli, Bengaluru, Karnataka 560037",57148785585,SKU_30,12-02-2023
Grant Harris,"Marathahalli Bridge Service Rd, Near Purva Riviera Apt, Spice Garden Layout, Lakshminarayana Pura, Munnekollal, Bengaluru, Karnataka 560037",49824885300,SKU_27,11-02-2023
William Clemmons,"Varthur Rd, Whitefield, Phase 1, Ramagondanahalli, Bengaluru, Karnataka 560066",98747852341,SKU_143,11-02-2023
William Creach,"No.510, Level 2, Phoenix Mall, Mahadevpura, Whitefield, Bengaluru, Karnataka 560048",56153028462,SKU_51,11-02-2023
Chris Medina,"23, MGM Mark, EPIP Zone Whitefield Rd, Kundalahalli, Brookefield, Bengaluru, Karnataka 560037",62372987092,SKU_1,12-02-2023
Carol Schumann,"Landmark: Opposite Carmel Kids, #21/14, Hagadur Main Rd, Whitefield, Prestige Ozone, Bengaluru, Karnataka 560066",45763595759,SKU_75,13-02-2023
Sandra Masztal,"XPMM+RC3, ITPL Backgate 3, Whitefield, KIADB Export Promotion Industrial Area, Krishnarajapura, Bengaluru, Karnataka 560066",41276779309,SKU_102,12-02-2023
Edith Hayes,"Food Court, SJR iPark, 14 And 15, Sy. Nos. 143 And 151,, Krishnarajpuram, Hobli, Plot No 13, Industrial Area, Whitefield, Bengaluru, Karnataka 560048",62849076151,SKU_12,11-02-2023
Hazel Londono,"4th floor, Saroj Group, Saroj Square, 1&2, Marathahalli Main Rd, Silver Springs Layout, Munnekollal, Bengaluru, Karnataka 560037",75211520409,SKU_76,12-02-2023
Edward Motyka,"Nexus Shantiniketan Mall, Whitefield Main Rd, Bengaluru, Karnataka 560067",14423562093,SKU_115,12-02-2023
Robert Jones,"Marathahalli Main Road, 352, 1st Cross Rd, Aswath Nagar, Bengaluru, Karnataka 560037",33503684464,SKU_78,12-02-2023
Felisha Naquin,"WMRW+352, Kadubeesanahalli Bridge, Kodbisanhalli, Kadabeesanahalli, Bengaluru, Karnataka 560103",60167788936,SKU_109,11-02-2023
Tabitha Paine,"WJ3Q+753, ITI Layout, Popular Colony, Mangammanapalya, Bengaluru, Karnataka 560068",59189784444,SKU_94,11-02-2023
Florene Son,"2, Graphite India Main Rd, Ashraya Layout, Seetharampalya, Mahadevapura, Bengaluru, Karnataka 560048",61210100840,SKU_33,11-02-2023
Fidel Christian,"67, 2nd Main Rd, near MVJ college, AKG colony, Channasandra, Bengaluru, Karnataka 560067",92748316440,SKU_146,12-02-2023
Andrea Peters,"25/7, Outer Ring Road, Doddannakundi, Marathahalli, Brindavan Extension, Mahadevapura, Bengaluru, Karnataka 560037",30403687775,SKU_83,13-02-2023
Victor Mitchell,"Whitefield Mainroad, 350, Service Rd, opp. Safal Daily Fresh Flyover, Aswath Nagar, Marathahalli, Bengaluru, Karnataka 560037",75775674109,SKU_74,12-02-2023
Judith Baumgartner,"Shop No. 6, 3rd Floor, Vasswani Matrix, ITPL Main Road, Aecs Layout,, Brookefield, Bengaluru, Karnataka 560037",41811549307,SKU_134,11-02-2023
Kathryn Robert,"International Tech Park Park Square Mall, No G9 & 10, Gr, Whitefield Main Rd, Bengaluru, Karnataka 560066",62869604580,SKU_58,12-02-2023
Russell Rester,"609, 1st floor, 1st Main Rd, Above Andhra Bank, AECS Layout - C Block, AECS Layout, Brookefield, Bengaluru, Karnataka 560037",16215280947,SKU_22,13-02-2023
Donna Allen,"23, Pattandur Agrahara Rd, Nallurhalli, Pattandur Agrahara Main Rd, Whitefield, Nallurhalli, Bengaluru, Karnataka 560066",45338881904,SKU_14,12-02-2023
Marie Luskey,"Saint Mary's Church Road, 32, MF Norrona St, opp. CUBBON PARK TRAFFIC POLICE STATION, Shivaji Nagar, Bengaluru, Karnataka 560051",28463831675,SKU_94,11-02-2023
Louise Lopez,"45/1, Leo Complex, Residency Cross Road, Shanthala Nagar, Ashok Nagar, Bengaluru, Karnataka 560025",72668952907,SKU_108,12-02-2023
Michael Gray,"3 Block, 12 20/5, Marathahalli - Sarjapur Outer Ring Rd, Kaverappa Layout, Kadubeesanahalli, Marathahalli, Bengaluru, Karnataka 560087",38649747060,SKU_7,11-02-2023
Gary Dykes,"#136/137, EPIP Industrial Area, Opposite SAP Labs, Whitefield, EPIP Zone, Brooke, Bengaluru, Karnataka 560066",29321956631,SKU_36,12-02-2023
George Brown,"45/1, Leo Complex, Residency Cross Road, Shanthala Nagar, Ashok Nagar, Bengaluru, Karnataka 560025",45049172815,SKU_114,11-02-2023
Lisa Sims,"#122/3, Sai Kamala Complex, ITPL Main Rd, Brookefield, Bengaluru, Karnataka 560037",97459989746,SKU_16,12-02-2023
Jack Goularte,"Belathur, Krishnarajapura, Bengaluru, Karnataka 560067",47457149567,SKU_138,13-02-2023
Nathan Poeppelman,"111/1, SGR Dental College Rd, Maruthi Layout, Kasavanahalli Village, Marathahalli, Bengaluru, Karnataka 560037",48007111842,SKU_62,11-02-2023
Sally Manning,"135, Marathahalli - Sarjapur Outer Ring Rd, Marathahalli Village, Marathahalli, Bengaluru, Karnataka 560037",37421424658,SKU_20,11-02-2023
Henry Holt,"SY No 82/4, Opposite Just Bake,Chembenahalli, Anekal Taluk, Sarjapura - Attibele Rd, Marathahalli, Bengaluru, Karnataka 562125",51195680019,SKU_80,13-02-2023
Parker Kasper,"Orion mall, 3rd floor food court, Dr Rajkumar Rd, Malleshwaram, Bengaluru, Karnataka 560055",33078869658,SKU_85,11-02-2023
Pamela Suter,"5, Anjandri Krest Complex, Munnekolala, Gandhi Nagar Rd, Lakshmi Layout, Gandhi Nagar, Munnekollal, Bengaluru, Karnataka 560037",61157341195,SKU_123,12-02-2023
Ralph Shibuya,"432, CMR Main Rd, HRBR Layout 2nd Block, HRBR Layout, Kalyan Nagar, Bengaluru, Karnataka 560043",55768439562,SKU_43,13-02-2023
Dorothy Chamberlin,"3rd Floor, 90/4, Marathahalli - Sarjapur Outer Ring Rd, near Park Plaza Hotel, Marathahalli Village, Munnekollal, Bengaluru, Karnataka 560037",82394707258,SKU_143,13-02-2023
Rodney Herring,"39, 1st Main St, R.J.Gardens, Anand Nagar, Aswath Nagar, Rajajinagar, Bengaluru, Karnataka 560037",26068946325,SKU_6,13-02-2023
Richard Stokes,"Novotel Bengaluru Tech Park, Marathahalli-Sarjapur Outer Ring Road, Kariyammana Agrahara, Bellandur, opp. Intel Campus, Bengaluru, Karnataka 560103",19304768485,SKU_4,11-02-2023
Robert Picken,"710, Varthur Rd, Whitefield, Thubarahalli, Brookefield, Bengaluru, Karnataka 560066",42150909014,SKU_74,13-02-2023
Helen Walton,"XP5J+PQQ, Opposite Devagiri Pearls, Rd, Whitefield, Siddapura, Bengaluru, Karnataka 560066",42167334675,SKU_118,11-02-2023
David Toney,"2, 8th Main Rd, KHB Block Koramangala, Koramangala 4-B Block, Koramangala 4th Block, Koramangala, Bengaluru, Karnataka 560034",48473993733,SKU_57,12-02-2023
Robert Workman,"XP68+2CP, Lakshminarayana Pura, AECS Layout, Marathahalli, Bengaluru, Karnataka 560037",71554050413,SKU_94,11-02-2023
Ebony Polk,"Silver Springs Layout, Munnekollal, Bengaluru, Karnataka 560037",21587981746,SKU_71,11-02-2023
Mariko Henry,"Service Road; Maratahalli-Sarjapura, Outer Ring Rd, Kadubeesanahalli, Bengaluru, Karnataka 560103",52727476818,SKU_58,12-02-2023
Jordan Crawford,"560066, Brooke Bond First Cross, Narayanappa Garden, Bengaluru, Karnataka 560066",86068176643,SKU_139,11-02-2023
Timothy Caballero,"2nd Floor A Square Plaza, ITPL Main Rd, Brookefield, Bengaluru, Karnataka 560037",26521706849,SKU_68,12-02-2023
John Ingle,"90/4, Outer Ring Rd, Marathahalli Village, Marathahalli, Bengaluru, Karnataka 560037",57573996899,SKU_46,12-02-2023
Jaymie Kim,"1, Varthur Rd, Chowdeshwari Layout, Marathahalli Village, Marathahalli, Bengaluru, Karnataka 560037",90508383293,SKU_110,11-02-2023
Jeanene Marzinske,"No. 473, 10th Main Rd, Hal, HAL 3rd Stage, Puttappa layout, New Tippasandra, Bengaluru, Karnataka 560075",88557686121,SKU_113,12-02-2023
Sharon Bowmer,"#82/3, Kaverappa Layout, Kadubeesanahalli, Panathur, Bengaluru, Karnataka 560103",84230779213,SKU_116,11-02-2023
Jacob Dipietro,"Shop No.4, S.H.R. Complex, Siddhapura, Varthur Rd, Whitefield, Bengaluru, Karnataka 560066",42102196932,SKU_80,11-02-2023
Geraldine Hayes,"84/1, Near Vasvani Reserve, Opp. SBI Bank, Kadubeesanahalli, Panathur Main Road, Marathahalli, Bangalore, Bengaluru, Karnataka 560103",79465062034,SKU_35,12-02-2023
Amanda Ford,"Nallurahalli Main Rd, Whitefield, Nallurhalli, Bengaluru, Karnataka 560066",55743318044,SKU_1,11-02-2023
June Shuman,"785, 2nd B Main Rd, Koramangala 8th Block, Koramangala, Bengaluru, Karnataka 560095",65988930743,SKU_21,12-02-2023
Margaret Porter,"Ground Floor, Inorbit Mall Whitefield, 75, Rd Number 7, Whitefield, EPIP Zone, Bengaluru, Karnataka 560066",98062350304,SKU_112,11-02-2023
Ramona Lash,"No 122/B, Outer Circle, behind Brothers Bakery, Whitefield, Dodsworth Layout, Bengaluru, Karnataka 560066",97680830703,SKU_121,11-02-2023
Wanda Olson,"Unit No. 1EB, Ground Floor, Building No.3, East Wing, 77 Town Centre Off:, HAL Old Airport Rd, Yemalur, P.O, Bengaluru, Karnataka 560037",96861504608,SKU_50,11-02-2023
William Shaw,"Shop No-6,D Ramiah Building, Whitefield Main Road opp-Nalapad Brigade Center, Garudachar Palya, Mahadevapura, Bengaluru, Karnataka 560048",67198940817,SKU_60,11-02-2023
Shane Davis,"XP47+566, Gulmohar Enclave Rd, Silver Springs Layout, Munnekollal, Bengaluru, Karnataka 560037",69105683468,SKU_24,11-02-2023
Orville Cabral,"Dodda Nekkundi Extension, Doddanekkundi, Bengaluru, Karnataka 560037",92692857991,SKU_76,11-02-2023
Angelina Chew,"#1, 1st floor, Kundalahalli, ITPL Main Road Post, AECS Layout, Marathahalli, Bengaluru, Karnataka 560037",99143511135,SKU_92,13-02-2023
Bethany Shilling,"3, ITPL Main Rd, AECS Layout, Marathahalli, Bengaluru, Karnataka 560037",46861921161,SKU_77,12-02-2023
Evelyn Moss,"Santhosh Towers, Ground Floor, Plot number 120-A3, EPIP Industrial Area, Phase 1, White Field, Bengaluru, Karnataka 560066",36625620486,SKU_140,11-02-2023
George Lheureux,"203, Whitefield Main Rd, Whitefield, Sathya Sai Layout, Bengaluru, Karnataka 560066",55073440000,SKU_112,12-02-2023
Asa Gormley,"Sarve no163/3/75 , siddhapura village Nellurahalli main road Oppo. To play 9, Whitefield, Siddapura, Bengaluru, Karnataka 560066",82141234829,SKU_6,11-02-2023
Crystal Simone,"No 78/2, KitchenPlus, Converge by UKN 1st and 2nd floor, Nallurahalli Main Rd, Whitefield, Bengaluru, Karnataka 560066",78883929978,SKU_64,11-02-2023
Mildred Grantham,"222, Sadaramangala, 220/A, ITPL Main Rd, opp. Shantiniketan Form Mall, Whitefield, KIADB Export Promotion Industrial Area, Bengaluru, Karnataka 560048",11936574491,SKU_67,11-02-2023
Deborah Thomas,"Unit No – 4a, 4b, Upper Ground Floor, VR Bengaluru Mall, Hobli Bengaluru East Taluk, Whitefield, Bengaluru, Karnataka 560066",60150675092,SKU_49,13-02-2023
Danny Terry,"3rd Floor, Park Square Mall, ITPL Main Rd, Whitefield, Bengaluru, Karnataka 560066",41862013942,SKU_83,11-02-2023
William Barger,"XP22+55F, SGR Dental College Rd, Near Madurai Idly, CKB Layout, Chandra Layout, Marathahalli, Bengaluru, Karnataka 560037",34773826476,SKU_41,12-02-2023
Elisa Amsterdam,"Venkatadri Plaza, 3rd Floor, 88, Outer Ring Rd, above Elite Ford, Kasavanahalli Village, Marathahalli, Bengaluru, Karnataka 560037",29466769822,SKU_39,12-02-2023
David Guevarra,"1st Floor, Ascendas Park Square Mall Whitefield Main Road, ITPL Main Rd, Bengaluru, Karnataka 560066",95428569930,SKU_19,13-02-2023
Walter Long,"Tulsi Theater Rd, Marathahalli Village, Marathahalli, Bengaluru, Karnataka 560037",54422343522,SKU_57,11-02-2023
Fletcher Wilson,"FORUM SHANTINIKETAN MALL, 2/ 3/ 4/ 5 Floor, ITPL Main Rd, Whitefield, Bengaluru, Karnataka 560067",66495602086,SKU_1,13-02-2023
Ramona Acevedo,"11/1, Robertson Rd, Pulikeshi Nagar, Bengaluru, Karnataka 560005",69998409924,SKU_24,11-02-2023
Joseph Kettler,"4th floor, Park Square Mall, Whitefield Main Rd, Pattandur Agrahara, Bengaluru, Karnataka 560066",26254929668,SKU_109,12-02-2023
Stephanie Peden,"Plot no. 75, Inorbit Mall, Level 1, EPIP area, Whitefield, Bengaluru, Karnataka 560066",56638174109,SKU_109,13-02-2023
Edward Huskey,"No.15, Marathahalli, Bengaluru, Karnataka 560066",92510189120,SKU_39,11-02-2023
Doreen Reynolds,"NTR Royal Plaza, 89/1, N Thimmareddy Building, road, Marathahalli Village, Marathahalli, Bengaluru, Karnataka 560037",86714978209,SKU_2,11-02-2023
Allan Robbins,"Sri Ananya Plaza, Jayanti Nagar, Horamavu, Bengaluru, Karnataka 560043",99871951153,SKU_78,11-02-2023
Bobby Sassaman,"47, Doddanekundi Main Rd, Pragathi Layout, Doddanekundi, Doddanekkundi, Bengaluru, Karnataka 560037",39055781480,SKU_118,13-02-2023
Edgar Cruz,"4th floor, S-6, Spice Garden Layout Airport, Varthur Rd, Munnekollal, Bengaluru, Karnataka 560037",28135431206,SKU_6,11-02-2023
Armand Powe,"Whitefield Main Rd, next to Anand sweet, Whitefield, Bengaluru, Karnataka 560066",23744882577,SKU_27,13-02-2023
Martin Rocco,"WPP3+P3X, Panathur Main Road, Kadubeesanahalli, Panathur, Bengaluru, Karnataka",47140560532,SKU_50,11-02-2023
Van Brooks,"XMHW+CMJ, Ferns City, Doddanekkundi, Bengaluru, Karnataka 560048",78726945697,SKU_111,11-02-2023
Vincent Potts,"No.15, Vivekananda Layout, Opposite Innovative Multiplex, near Biryani Zone, Marathahalli, , Hyderabadi Dum Biryani Restaurant, Marathahalli, Bengaluru, Karnataka 560037",95884702155,SKU_110,11-02-2023
Julie Scott,"#90-91, Soul Space Paradigm, Bata Showroom,, Outer Ring Road, Marathahalli, next to Innovative Multiplex, Bengaluru, Karnataka 560037",66244223860,SKU_11,13-02-2023
Alfred Hebert,"No 7,#35/1B, CRM Sowbhagya Annex, Varthur Rd, Lakshminarayana Pura, Marathahalli, Bengaluru, Karnataka 560037",24738714219,SKU_9,12-02-2023
Kimberly Lee,"90/4, Outer Ring Rd, Munnekollalu Village, Marathahalli Village, Marathahalli, Bengaluru, Karnataka 560037",13528691604,SKU_127,12-02-2023
Adam Scanlon,"5, SGR Dental College Rd, Sri Balaji Layout, Kasavanahalli Village, Marathahalli, Bengaluru, Karnataka 560037",56319790143,SKU_58,11-02-2023
Leroy Murphy,"Novotel Bengaluru Outer Ring Road, Opposite RMZ Ecospace Business Park Marthahalli, Marathahalli - Sarjapur Outer Ring Rd, Kariyammana Agrahara, Bengaluru, Karnataka 560103",97594458127,SKU_36,13-02-2023
Benjamin Mackillop,"WMRW+352, Kadubeesanahalli Bridge, Kodbisanhalli, Kadabeesanahalli, Bengaluru, Karnataka 560103",59601730639,SKU_2,13-02-2023
Kenneth Mueller,"XQX4+2X7, Vijaya Lakshmi Colony, Belatur Colony, Kadugodi, Bengaluru, Karnataka 560067",19149621680,SKU_66,11-02-2023
Jonathan Hunt,"3 & 4, KIADB, Sadaramangala Opposite ITPL, Whitefield Road, Sadaramangala Rd, KIADB Export Promotion Industrial Area, Kadugodi, Bengaluru, Karnataka 560066",66752534538,SKU_100,11-02-2023
Rose Ray,"XPM9+XCV, Seetharampalya - Hoodi Rd, Shivaji Nagar, Seetharampalya, Bengaluru, Karnataka 560048",17562632650,SKU_40,11-02-2023
Buford Cook,"1st Cross Rd, BEML Layout 6th Stage, BEML Layout, Brookefield, Bengaluru, Karnataka 560066",45620197614,SKU_105,11-02-2023
Nancy Easley,"WJ44+RCW, 7th Main Rd, Abbaappa Layout, BTM 2nd Stage, BTM Layout, Bengaluru, Karnataka 560076",63488221776,SKU_105,11-02-2023
Shannon Anderson,"952, Gali Rd, Whitefield Main Rd, beside Fresh Mart Super Market, Maruthi Nagar, Thigalarapalya, Hoodi, Bengaluru, Karnataka 560048",66559851021,SKU_12,11-02-2023
Stephen Holly,"216, 2nd Cross Rd, Kundalahalli Colony, Brookefield, Bengaluru, Karnataka 560037",48239224232,SKU_41,11-02-2023
Shirley Esquerra,"107/P4, Ground Floor, Pattanduru Aghara (V), Whitefield, Bengaluru, BBMP East, Karnataka 560068",71909409955,SKU_16,13-02-2023
Tony Muresan,"No 1, 1st Floor, Outer Ring Road, Munenkollal, Service Rd, next to YES Bank on, Marathahalli, Bengaluru, Karnataka 560037",90673477069,SKU_96,11-02-2023
Ronald Angelico,"XMWW+H59, Food Court, VR Mall, Bengaluru, 560048",44667438463,SKU_54,12-02-2023
Catherine Pacheco,"12, Kundalahalli Main Rd, Vaikuntam Layout, Lakshminarayana Pura, AECS Layout, Marathahalli, Bengaluru, Karnataka 560037",11795093843,SKU_58,11-02-2023
Jennifer Baumler,"ITPL Main Rd, Brigade Metropolis, Garudachar Palya, Mahadevapura, Bengaluru, Karnataka 560048",73820496439,SKU_113,12-02-2023
Katie Hebert,"XPV2+GP4, Garudachar Palya, Mahadevapura, Bengaluru, Karnataka 560048",85186278781,SKU_46,11-02-2023
Diane Fusco,"Prasanthi Complex, Channasandra Main Rd, Chansandra, J, Whitefield, Bengaluru, Karnataka 560067",24447361265,SKU_95,11-02-2023
Linda Davenport,"No 61/2, HNR Garden, Marathahalli, Sai Baba Temple Rd, Shirdi Sai Nagar, Munnekollal, Bengaluru, Karnataka 560037",16573776885,SKU_98,11-02-2023
Ronnie Perez,"35/1-C, Varthur Rd, Lakshminarayana Pura, AECS Layout, Marathahalli, Bengaluru, Karnataka 560037",11534313886,SKU_149,13-02-2023
Jose Easley,"No. 310,Brinthavan, near CMRIT College, B Block, AECS Layout, Brookefield, Bengaluru, Karnataka 560037",43119589805,SKU_36,11-02-2023
Jody Gardner,"3, Jr College Rd, opp. GR elesium, Belathur, Kadugodi, Bengaluru, Karnataka 560067",66611196121,SKU_89,11-02-2023
Stanley Spillman,"5th Floor, Swamy Lagoto Building, 7, Outer Ring Rd, above Kia Motors, Kadubeesanahalli, Marathahalli, Bengaluru, Karnataka 560103",66678930804,SKU_126,11-02-2023
Michael Carlson,"shop no 4, 346, 4th Main Rd, B Block, AECS Layout, Brookefield, Bengaluru, Karnataka 560037",96370444261,SKU_101,12-02-2023
Georgia Nguyen,"No.44, 1st Main St, R.J.Gardens, Anand Nagar, Aswath Nagar, Chinnapanna Halli, Bengaluru, Karnataka 560004",20296871768,SKU_137,11-02-2023
Julio Garcia,"83/2, 5th main, Shantiniketan layout, Munnekollala, Marathahalli, Bengaluru, Karnataka 560037",39640999481,SKU_41,12-02-2023
Lorraine Wilson,"No 56, outer ring road, Lakshman Reddy building, Devarabisanahalli, Bengaluru, Karnataka 560103",50509143317,SKU_128,11-02-2023
Bryce Cadet,"2, 8th Main Rd, KHB Block Koramangala, Koramangala 4-B Block, Koramangala 4th Block, Koramangala, Bengaluru, Karnataka 560034",57196210538,SKU_1,13-02-2023
William Lawrence,"No 36, Arena Mall, Municipal No 2028 Sy, 5, Outer Ring Rd, Doddanekundi, Bengaluru, Karnataka 560037",15792804830,SKU_59,11-02-2023
