names,addresses,awb,product_id,EDD
Erica Timmerman,"1160, 5th Main Rd, Sector 7, HSR Layout, Bengaluru, Karnataka 560102",94969197225,SKU_90,13-02-2023
Rico Swink,"17/J, 18th Cross Rd, Sector 3, HSR Layout, Bengaluru, Karnataka 560102",79981700616,SKU_23,13-02-2023
Phillip Rodriguez,"Green Grand Layout Kundhanahalli, Gate, Bengaluru, Karnataka 560037",74799169557,SKU_91,13-02-2023
Laverne King,"Shop#12, Siddapura, SM Munivenkatappa Nursery, Varthur Rd, Siddapura, Bengaluru, Karnataka 560066",49589109688,SKU_43,12-02-2023
Andrea Martin,"714, Basement 60 Feet Road, 1st Main Rd, C block, AECS Layout, Marathahalli, Bengaluru, Karnataka 560037",18704452906,SKU_124,11-02-2023
Lucy Meighan,"WMXX+7GJ, Marathahalli Village, Marathahalli, Bengaluru, Karnataka 560037",72942067986,SKU_36,12-02-2023
David Deleon,"ITPL Main Rd, Opposite to Vydehi hospital entrance, near Vydehi Circle, Whitefield, Vijayanagar, EPIP Zone, Bengaluru, Karnataka 560066",24070444357,SKU_43,11-02-2023
Will Ridenour,"#389/2,7th Cross, Tulsi Theater Rd, Marathahalli, Bengaluru, Karnataka 560037",81981557652,SKU_79,13-02-2023
Joyce Garza,"135, Varthur Rd, Lakshminarayana Pura, Chandra Layout, Marathahalli, Bengaluru, Karnataka 560037",27274060456,SKU_127,11-02-2023
Erica Sannicolas,"NTR Royal Plaza, 89/1, N Thimmareddy Building, road, Marathahalli Village, Marathahalli, Bengaluru, Karnataka 560037",55635691068,SKU_63,12-02-2023
Rebecca Kunkel,"1st Floor, Katha Nos. 208/157, 209/158, 210/159 and 211/160, Situated at Thubarahalli Village, Varthur Hobli, Bangalore East Taluk, Bengaluru, Karnataka 560066",56527027184,SKU_59,12-02-2023
Kristin Naves,"2148, 2nd B Cross Rd, HAL 2nd Stage, Indiranagar, Bengaluru, Karnataka 560008",25460483498,SKU_45,13-02-2023
Charles Garcia,"560008, Channakesahava Nagar, HAL 2nd Stage, Doopanahalli, Indiranagar, Bengaluru, Karnataka 560008",90781147734,SKU_75,12-02-2023
Lenard Pring,"34, Rest House Rd, Shanthala Nagar, Sampangi Rama Nagara, Bengaluru, Karnataka 560001",64374305829,SKU_148,12-02-2023
James Santos,"7, Chinmaya Mission Hospital Rd, opp. Pillar No 77, Stage 2, Hoysala Nagar, Indiranagar, Bengaluru, Karnataka 560038",17697695934,SKU_128,11-02-2023
Ronald Daniels,"5th Floor, 541-543, 100 Feet Rd, Amarjyoti Layout, Bengaluru, Karnataka 560071",35680179812,SKU_14,12-02-2023
Jessie Black,"120, Brigade Road, 4th Floor, Lancer Building, Ashok Nagar, Bengaluru, Karnataka 560025",64258027358,SKU_43,11-02-2023
Edward Miers,"Public Utility Building, 36 1, Mahatma Gandhi Rd, Halasuru, Karnataka 560001",82408916671,SKU_64,11-02-2023
Charles Holscher,"Church St, Haridevpur, Shanthala Nagar, Ashok Nagar, Bengaluru, Karnataka 560001",74435814913,SKU_109,11-02-2023
Richard Rush,"#3167, ESI Hospital Road, HAL 2nd Stage, Indiranagar, HAL 2nd Stage, Indiranagar, Bengaluru, Karnataka 560008",32458658443,SKU_105,12-02-2023
Jospeh Jackson,"332, Binnamangala, Hoysala Nagar, Indiranagar, Bengaluru, Karnataka 560038",29573420616,SKU_29,11-02-2023
Rachel Lakey,"No. 842/A, Ground and Mezzanine Floor, 100 Feet Rd, Indira Nagar 1st Stage, Bengaluru, Karnataka 560038",88016951898,SKU_77,11-02-2023
Michelle Allen,"47, Banashankari Stage II, Yellappa Garden, Yellappa Chetty Layout, Sivanchetti Gardens, Bengaluru, Karnataka 560001",43909611181,SKU_128,11-02-2023
Robert Diaz,"Tower-B, 13th floor, No. 84, Mahatma Gandhi Rd, Bengaluru, Karnataka 560001",98718104186,SKU_99,12-02-2023
Melba Fish,"14, Church St, Shanthala Nagar, Ashok Nagar, Bengaluru, Karnataka 560001",42367708327,SKU_81,12-02-2023
Ruth Shaffer,"#56, Above Star bucks, Church St, Bengaluru, Karnataka 560001",42400924705,SKU_117,11-02-2023
Kelly Shaw,"XJ6P+37F, 1st A Main Rd, Domlur I Stage, 1st Stage, Domlur, Bengaluru, Karnataka 560071",89770901410,SKU_13,12-02-2023
Suzi Lucas,"636, 100 Feet Rd, 6th Block, Koramangala, Bengaluru, Karnataka 560095",82874040512,SKU_30,11-02-2023
Teresa Labonte,"Mahatma Gandhi Rd, Craig Park Layout, Ashok Nagar, Bengaluru, Karnataka 560001",12064301093,SKU_128,13-02-2023
Melvin Huckabaa,"19, Mahatma Gandhi Rd, Haridevpur, Shanthala Nagar, Shivaji Nagar, Bengaluru, Karnataka 560001",33836869686,SKU_118,11-02-2023
Rhonda Carp,"#54, 2nd Floor, MSK Plaza, 3rd Main, 100 Feet Rd, Above Cafe Coffee Day, Indiranagar, Bengaluru, Karnataka 560038",37486367181,SKU_149,12-02-2023
Sandra Frith,"1MG, 2nd Floor, Lido Mall Trinity Circle, Mahatma Gandhi Rd, opposite Taj Vivanta, Bengaluru, Karnataka 560008",14991248226,SKU_115,11-02-2023
Dewayne Hogue,"Mahatma Gandhi Rd, opposite Metro Station, Bengaluru, Karnataka 560001",73470696839,SKU_25,12-02-2023
Wilbur Steel,"50, Lavelle Road, Shanthala Nagar, Ashok Nagar, Bengaluru, Karnataka 560001",97229486915,SKU_32,11-02-2023
Laura Concepcion,"No-307, k.p square, 100 Feet Rd, Indiranagar, Bengaluru, Karnataka 560038",73091417374,SKU_55,12-02-2023
Ettie Macri,"204, 5th Main, 7th Cross, Indiranagar I Stage, Bengaluru, Karnataka 560038",82226241441,SKU_26,12-02-2023
Kimberly Smith,"The Park, MG Road, 14/7, Bhaskaran Rd, Sivanchetti Gardens, Bengaluru, Karnataka 560042",82300206930,SKU_75,12-02-2023
Robert Beckham,"86, Shop No 3, 17th B Main, No, Off, 100 Feet Rd, HAL 2nd Stage, Indiranagar, Bengaluru, Karnataka 560008",93634870497,SKU_89,11-02-2023
Lucille Streeter,"XJ5V+C4X, Natasha Golf View Apartments, Domlur Layout, Opposite Diamond District, Domlur, Bengaluru, Karnataka 560071",91665387147,SKU_126,12-02-2023
Sherman Lawson,"1134, 100 Feet Rd, 2nd stage Indiranagar, HAL 2nd Stage, Domlur Village, Indiranagar, Bengaluru, Karnataka 560038",50222264847,SKU_93,11-02-2023
David Dray,"XJ6Q+8C4, 7th Cross Rd, Domlur I Stage, 1st Stage, Domlur, Bengaluru, Karnataka 560071",68287525665,SKU_50,13-02-2023
Daniel Green,"Brigade Road,Opposite Brigade Towers, Plot No. 124, Near Vellara Junction, Bengaluru, Karnataka 560050",51370466757,SKU_135,11-02-2023
Tennille Spikes,"1/A, Church St, off MG/Bridge Road, Shanthala Nagar, Ashok Nagar, Bengaluru, Karnataka 560001",89245386359,SKU_101,11-02-2023
Julie Thomas,"410, 7th Cross Rd, Domlur I Stage, Stage 2, Domlur, Bengaluru, Karnataka 560071",19769725872,SKU_56,12-02-2023
Franklin Villa,"No.1, 17e, Chinmaya Mission Hospital Rd, 2nd stage Indiranagar, BDA Colony, Domlur Village, Indiranagar, Bengaluru, Karnataka 560008",43043276190,SKU_27,11-02-2023
Mary Tunney,"Brigade Road Shop No. 2, 1st Floor, Church St, Ashok Nagar, Bengaluru, Karnataka 560001",71333334978,SKU_4,11-02-2023
Audrey Maynard,"No. 46, 80 Feet Rd, Hal, HAL 3rd Stage, Indiranagar, Bengaluru, Karnataka 560038",59915936354,SKU_26,11-02-2023
Robert Buntrock,"618, 2nd Main Rd, next to Zframez Technologies Pvt, Binnamangala, Hoysala Nagar, Indiranagar, Bengaluru, Karnataka 560038",41980601618,SKU_136,11-02-2023
John Goode,"Old Madras Rd, Halasuru, Yellappa Chetty Layout, Jogupalya, Bengaluru, Karnataka 560001",88629469200,SKU_142,11-02-2023
Donald Canfield,"2011, 100 Feet Rd, HAL 2nd Stage, Indiranagar, Bengaluru, Karnataka 560038",81745729128,SKU_84,11-02-2023
Randy Relyea,"Ground Floor & 1st Floor, Brigade Rd, opposite Space Centre, Shanthala Nagar, Ashok Nagar, Bengaluru, Karnataka 560029",91971513725,SKU_15,11-02-2023
Charles Clay,"No 267, Ground Floor, J K, Golf Course Rd, Amarjyoti Layout, Domlur, Bengaluru, Karnataka 560071",38306592774,SKU_146,11-02-2023
James Hannigan,"560103 Agrahara Main Road Chandana, Kariyammana Agrahara, Bengaluru, Karnataka 560103",84843449706,SKU_142,11-02-2023
Leah Boesiger,"#298, 7th Cross Rd, Domlur I Stage, 1st Stage, Domlur, Bengaluru, Karnataka 560071",27244493687,SKU_55,11-02-2023
Vincent Pursifull,"3, Brigade Rd, Shanthala Nagar, Ashok Nagar, Bengaluru, Karnataka 560001",78325650516,SKU_89,11-02-2023
Daniel Broyles,"77, Mahatma Gandhi Rd, Haridevpur, Shanthala Nagar, Sampangiram Nagar, Bengaluru, Karnataka 560001",67171820407,SKU_54,11-02-2023
Pam Smith,"1/A, Church St, off MG/Bridge Road, Shanthala Nagar, Ashok Nagar, Bengaluru, Karnataka 560001",80290324862,SKU_39,11-02-2023
Ann Sharp,"Public Utility Building, 2nd, Mahatma Gandhi Rd, Shanthala Nagar, Ashok Nagar, Bengaluru, Karnataka 560001",11125126109,SKU_145,11-02-2023
Samantha Sparks,"46,9th Main Road, 80 Feet Rd, opposite BSNL telephone Exchange, HAL 3rd Stage, Indiranagar, Bengaluru, Karnataka 560038",99383127130,SKU_52,12-02-2023
Curtis Pal,"177/178, 100 Feet Rd, Amarjyoti Layout, Domlur, Bengaluru, Karnataka 560071",49733009250,SKU_22,11-02-2023
Alexander Beausoleil,"Shop No. 24, No. 121, Civil Station, Brigade Rd, Ashok Nagar, Bengaluru, Karnataka 560025",40758829703,SKU_42,13-02-2023
Derek Dominick,"Unit No - 11, Ground Floor, Opp St Josephs Commerce College, Brigade Rd, next to Kanthi Sweets, Karnataka 560025",69372732581,SKU_94,11-02-2023
Frances Corbin,"238, 13th Cross Rd, Indira Nagar II Stage, Hoysala Nagar, Indiranagar, Bengaluru, Karnataka 560038",53254816682,SKU_108,12-02-2023
Keith Wronski,"16/3, Church St, Shanthala Nagar, Ashok Nagar, Bengaluru, Karnataka 560001",56067058373,SKU_95,11-02-2023
Sandra Miranda,"No 148 & 149, St Thomas Building, Brigade Rd, Shanthala Nagar, Ashok Nagar, Karnataka 560025",76578789444,SKU_141,11-02-2023
Timothy Ferguson,"2017, 100 Feet Rd, HAL 2nd Stage, Indiranagar, Bengaluru, Karnataka 560038",71022851843,SKU_74,11-02-2023
Forrest Smith,"1300, 13th Cross Rd, Eshwara Layout, Indiranagar, Bengaluru, Karnataka 560038",73854643819,SKU_62,13-02-2023
John Boykin,"442, 2nd Cross Rd, HAL 2nd Stage, Indiranagar, Bengaluru, Karnataka 560038",77922074513,SKU_17,13-02-2023
Jacqueline Castillo,"Teacher's Colony, Jakkasandra, 1st Block Koramangala, HSR Layout 5th Sector, Bengaluru, Karnataka 560034",35124917203,SKU_120,13-02-2023
Nancy Wilson,"410, 7th Cross Rd, Domlur I Stage, Stage 2, Domlur, Bengaluru, Karnataka 560071",63205279519,SKU_21,12-02-2023
Paul Folse,"XJG3+554, Church St, Haridevpur, Shanthala Nagar, Ashok Nagar, Bengaluru, Karnataka 560001",59679931367,SKU_30,11-02-2023
Paulette Spade,"1MG, 2nd Floor, Lido Mall Trinity Circle, Mahatma Gandhi Rd, opposite Taj Vivanta, Bengaluru, Karnataka 560008",95647587854,SKU_28,11-02-2023
Lowell Williams,"Tower-B, 13th Floor, 84, Mahatma Gandhi Rd, Bengaluru, Karnataka 560001",31546680298,SKU_120,11-02-2023
Alice Williams,"514, Krishna Reddy Layout, Amarjyoti Layout, Domlur, Bengaluru, Karnataka 560071",25979298621,SKU_121,12-02-2023
Mary Johnson,"48,, Church St, Haridevpur, Shanthala Nagar, Ashok Nagar, Bengaluru, Karnataka 560001",67275680684,SKU_115,12-02-2023
Blake Toure,"31, Asha Building, Ground Floor, Church Street, Bengaluru, Karnataka 560001",32553693346,SKU_100,12-02-2023
Linda Aronoff,"XJG3+554, Church St, Haridevpur, Shanthala Nagar, Ashok Nagar, Bengaluru, Karnataka 560001",87193217399,SKU_85,11-02-2023
Robert Maenpaa,"#15K-1, D Block, St. Patrick's Church, Brigade Road, Shantalanagar, Bengaluru, Karnataka 560025",87559583556,SKU_92,11-02-2023
John Cisco,"SB Tower No. 88, 1st Floor, Mahatma Gandhi Rd, Haridevpur, Shanthala Nagar, Ashok Nagar, Bengaluru, Karnataka 560001",40128430377,SKU_81,12-02-2023
James Purnell,"770, 12th Main Rd, HAL 2nd Stage, Doopanahalli, Indiranagar, Bengaluru, Karnataka 560038",16763034118,SKU_75,13-02-2023
Pattie Milam,"21/A, nr. Honda Service Center, K.R.Colony, Krishna Reddy Layout, Domlur, Bengaluru, Karnataka 560071",46351858729,SKU_119,11-02-2023
Janice Christensen,"3051, 80 Feet Rd, 8th cross, HAL 2nd Stage, Indiranagar, Bengaluru, Karnataka 560038",59651690599,SKU_109,13-02-2023
Susan Gruber,"50/1, Church St, Shanthala Nagar, Ashok Nagar, Bengaluru, Karnataka 560001",64679928398,SKU_68,11-02-2023
Paul Padilla,"Brigade Rd, opp. St Joseph commerce College, Shanthala Nagar, Ashok Nagar, Bengaluru, Karnataka 560001",72681324883,SKU_59,11-02-2023
Paula Hourigan,"276, 2nd Floor, 100 Feet Rd, Defence Colony, Indiranagar, Bengaluru, Karnataka 560038",88958195373,SKU_10,13-02-2023
Courtney Schwartz,"No 148 & 149, St Thomas Building, Brigade Rd, Ashok Nagar, Bengaluru, Karnataka 560025",12192187759,SKU_140,11-02-2023
Vicki Demby,"647, 100 Feet Rd, 2nd stage Indiranagar, BDA Colony, Domlur Village, Indiranagar, Bengaluru, Karnataka 560038",66515329793,SKU_79,12-02-2023
Claudia Pell,"24, Church St, Shanthala Nagar, Ashok Nagar, Bengaluru, Karnataka 560001",43109949580,SKU_14,11-02-2023
John Park,"6, 2, Primrose Rd, Craig Park Layout, Sivanchetti Gardens, Bengaluru, Karnataka 560025",89245690113,SKU_106,13-02-2023
Clarence Kissinger,"No 325, Mahatma Gandhi Rd, Haridevpur, Shanthala Nagar, Shivaji Nagar, Bengaluru, Karnataka 560001",53665289250,SKU_54,11-02-2023
Heather Leonard,"12, Chinmaya Mission Hospital Rd, Hoysala Nagar, Indiranagar, Bengaluru, Karnataka 560038",53341462689,SKU_144,11-02-2023
Laura Marrero,"XJ2V+22R, Embassy Golf Links Business Park, Challaghatta, Bengaluru, Karnataka 560071",18548951914,SKU_46,12-02-2023
Dustin Ortiz,"52, Mahatma Gandhi Rd, Haridevpur, Shanthala Nagar, Shivaji Nagar, Bengaluru, Karnataka 560001",59285051850,SKU_43,12-02-2023
Cynthia Grenier,"4-9, Brigade Rd, Shanthala Nagar, Ashok Nagar, Bengaluru, Karnataka 560025",39960178648,SKU_30,11-02-2023
Linda Easley,"68, G-1, 4th Cross Road, 10th Main Rd, Stage 2, Indiranagar, Bengaluru, Karnataka 560038",57236290260,SKU_67,11-02-2023
Courtney Burton,"nd stage, #4062, 19th A Main Rd, behind Carlton Towers, HAL 2nd Stage, HAL, Bengaluru, Karnataka 560008",71915822980,SKU_148,13-02-2023
Kimberly Brady,"34, Rest House Rd, Shanthala Nagar, Sampangi Rama Nagara, Bengaluru, Karnataka 560001",64248549227,SKU_141,12-02-2023
Linda Armstrong,"693,, 17th E Cross Rd, Chinmaya Mission Hospital Rd, laksmipuram, Indiranagar, Bengaluru, Karnataka 560038",69249870508,SKU_127,12-02-2023
Yolanda Carchi,"WJXV+PC8, Embassy Golf Links Business Park, Challaghatta, Bengaluru, Karnataka 560071",14106018949,SKU_32,11-02-2023
Cynthia Peterson,"No. 3115, East West Apartment, 13th Cross, Indiranagar 2nd Stage, Near ESI Hospital, Bengaluru, Karnataka 560038",94846775697,SKU_122,12-02-2023
Conrad Davenport,"Garuda Mall, Magrath Rd, Ashok Nagar, Bengaluru, Karnataka 560025",66264640670,SKU_129,13-02-2023
Maria Criswell,"XJF3+VX7, Shanthala Nagar, Ashok Nagar, Bengaluru, Karnataka 560001",48917242424,SKU_139,11-02-2023
Gregory Carrico,"#15K-1, D Block, St. Patrick's Church, Brigade Road, Shantalanagar, Bengaluru, Karnataka 560025",54704659133,SKU_126,13-02-2023
Catherine Michael,"44, Church St, Haridevpur, Shanthala Nagar, Ashok Nagar, Bengaluru, Karnataka 560001",30376490790,SKU_127,11-02-2023
Eileen Shuler,"2nd Floor, # 618, 12th Main Rd, above Chicco, Indiranagar, Bengaluru, Karnataka 560038",25086447418,SKU_3,11-02-2023
Jennifer Brown,"Cavalcade, Kids Camp, 18, Mahatma Gandhi Rd, Ashok Nagar, Bengaluru, Karnataka 560001",49039146564,SKU_18,13-02-2023
Nicholas Smith,"54, Brigade Rd, Shanthala Nagar, Sampangi Rama Nagar, Bengaluru, Karnataka 560001",16722470479,SKU_140,12-02-2023
Lora Clay,"40, Kempegowda Service Rd, Domlur I Stage, 1st Stage, Domlur, Bengaluru, Karnataka 560071",81184966860,SKU_15,12-02-2023
Harry May,"Valiant Ventures, Triumph Tower Tower No. 48 Ground Floor, Church St, Shanthala Nagar, Ashok Nagar, Bengaluru, Karnataka 560001",26789195733,SKU_147,13-02-2023
Rodger Alexander,"123, Brigade Rd, Shanthala Nagar, Ashok Nagar, Bengaluru, Karnataka 560025",25406344462,SKU_119,12-02-2023
Long Brown,"68, G-1, 4th Cross Road, 10th Main Rd, Stage 2, Indiranagar, Bengaluru, Karnataka 560038",12947061891,SKU_77,12-02-2023
Amanda Elias,"XJCV+Q34, 3rd Cross Rd, HAL 2nd Stage, Indiranagar, Bengaluru, Karnataka 560038",19884650417,SKU_108,12-02-2023
Tracy Gray,"Tower-B, 13th floor, 84, Mahatma Gandhi Rd, Bengaluru, Karnataka 560001",78730479463,SKU_63,11-02-2023
Esperanza Sargent,"1362-B, 1st Main Rd, Defence Colony, Domlur, Bengaluru, Karnataka 560071",68813316077,SKU_10,12-02-2023
Karey Greigo,"No.1, 17e, Chinmaya Mission Hospital Rd, 2nd stage Indiranagar, BDA Colony, Domlur Village, Indiranagar, Bengaluru, Karnataka 560008",85356846530,SKU_89,12-02-2023
William Nelson,"9, Brigade Rd, Ashok Nagar, Bengaluru, Karnataka 560025",72386739449,SKU_27,12-02-2023
Mike Hogan,"54, Brigade Rd, Shanthala Nagar, Sampangi Rama Nagar, Bengaluru, Karnataka 560001",71313694263,SKU_6,11-02-2023
Pearlie Scott,"172B, 2nd Cross Road, Shankarnag Rd, off Paramahansa Yogananda Road, next to Ceekay Supermarket, Bengaluru, Karnataka 560071",79172755652,SKU_37,12-02-2023
Andrew Williams,"89, 11th Cross Rd, Stage 2, Hoysala Nagar, Indiranagar, Bengaluru, Karnataka 560038",30578273189,SKU_89,12-02-2023
James Finkenbinder,"4-9, Brigade Rd, Shanthala Nagar, Ashok Nagar, Bengaluru, Karnataka 560025",79114361880,SKU_4,12-02-2023
Vera Ferguson,"Ashok Nagar, Bengaluru, Karnataka 560025",29245152159,SKU_3,11-02-2023
Jim Beck,"Tower-B, 13th floor, 84, Mahatma Gandhi Rd, Bengaluru, Karnataka 560001",61806405086,SKU_19,13-02-2023
Jennifer Pettengill,"41, Dickenson Rd, Halasuru, Yellappa Garden, Rukmani Colony, Sivanchetti Gardens, Bengaluru, Karnataka 560042",37804817887,SKU_138,11-02-2023
Allan Person,"Brigade Road,Opposite Brigade Towers, Plot No. 124, Near Vellara Junction, Bengaluru, Karnataka 560050",28247828867,SKU_105,13-02-2023
Jeffrey Tucker,"7, Aaimata Temple Rd, KSFC Layout, Lingarajapuram, Bengaluru, Karnataka 560084",61739043245,SKU_120,13-02-2023
Monika Bryant,"3, Church St, Shanthala Nagar, MSR, Bengaluru, Karnataka 560001",18017508334,SKU_100,11-02-2023
Ambrose Barron,"212/A, 1st Main Rd, 2nd stage Indiranagar, BDA Colony, Domlur Village, Indiranagar, Bengaluru, Karnataka 560038",51179236757,SKU_141,12-02-2023
Adrian Hopkins,"1080, 12th Main Rd, HAL 2nd Stage, Appareddipalya, Indiranagar, Bengaluru, Karnataka 560008",59265924572,SKU_55,11-02-2023
Joseph Walker,"XJHQ+CVX, 7th Cross Road, Binnamangala, Hoysala Nagar, Indiranagar, Bengaluru, Karnataka 560038",79721797627,SKU_45,11-02-2023
Brooke Harris,"21/A, nr. Honda Service Center, K.R.Colony, Krishna Reddy Layout, Domlur, Bengaluru, Karnataka 560071",76933131669,SKU_69,11-02-2023
Ray Donovan,"540, 100 Feet Rd, Krishna Reddy Layout, Amarjyoti Layout, Domlur, Bengaluru, Karnataka 560071",74587798761,SKU_144,13-02-2023
Cassie Boyd,"373/2, 100 Feet Rd, HAL 2nd Stage, Stage 1, Indiranagar, Bengaluru, Karnataka 560038",44692226253,SKU_31,11-02-2023
Christie Smith,"100 Feet Rd, HAL 2nd Stage, Kodihalli, Bengaluru, Karnataka 560008",67032882713,SKU_128,11-02-2023
Joshua Allbritton,"Royal Orchid Central, Manipal Center, Dickenson Road,, Bengaluru, Karnataka 560042",28654634050,SKU_75,12-02-2023
Anthony Villasenor,"XJ2Q+WXH, 100 Feet Rd, Krishna Reddy Layout, Amarjyoti Layout, Domlur, Bengaluru, Karnataka 560071",57456948131,SKU_146,13-02-2023
Bruce Mckinney,"204, 5th Main, 7th Cross, Indiranagar I Stage, Bengaluru, Karnataka 560038",33287679570,SKU_149,11-02-2023
Joe Le,"4005, 100 Feet Rd, HAL 2nd Stage, Stage 2, Indiranagar, Bengaluru, Karnataka 560038",84653395522,SKU_110,11-02-2023
Samuel Prezzia,4 km,23662468343,SKU_103,12-02-2023
Gladys Charles,"#621/B, G-05, Ground Floor, 12th Main Rd, HAL 2nd Stage, Indiranagar, Bengaluru, Karnataka 560038",84176048831,SKU_19,11-02-2023
Lisa Zak,"Prince Arcade, 1083, 12th Main Rd, 2nd stage Indiranagar, HAL 2nd Stage, Domlur Village, Indiranagar, Bengaluru, Karnataka 560038",40554174009,SKU_127,11-02-2023
Gregory Smith,"11-15, 1st Main Rd, Domlur I Stage, 1st Stage, Domlur, Bengaluru, Karnataka 560071",83136638406,SKU_75,13-02-2023
James Tiemann,"Fifth Floor, 1 MG Mall, Old Madras Rd, Halasuru, Someshwarpura, Karnataka 560001",22799851008,SKU_105,11-02-2023
Marcia Gonzalez,"Brigade Road,Opposite Brigade Towers, Plot No. 124, Near Vellara Junction, Bengaluru, Karnataka 560050",53207810503,SKU_7,11-02-2023
Sandra Lilly,"#32, 12th main, junction, 80 Feet Rd, above keto kitchen, Indiranagar, Bengaluru, Karnataka 560038",92475864499,SKU_121,11-02-2023
Barbara Hemphill,"70, Markham Road Off Brigade Road Next To Ocea Hotel, Ashok Nagar, Richmond Town, Bengaluru, Karnataka 560025",27139290262,SKU_98,12-02-2023
Haydee Shively,"Chai Point, Trinity, Mahatma Gandhi Rd, Craig Park Layout, Ashok Nagar, Bengaluru, Karnataka 560001",71869692482,SKU_120,11-02-2023
Adam Field,"755, Shri Krishna Temple Rd, Kalyan Nagar, Indira Nagar 1st Stage, Stage 1, Indiranagar, Bengaluru, Karnataka 560038",98637325727,SKU_37,11-02-2023
Troy Dietzler,"2nd floor, 33, Church St, Above Mainland China, Shanthi Nagar, Ashok Nagar, Bengaluru, Karnataka 560001",48165164015,SKU_132,11-02-2023
Madeline Dixon,"No 148 & 149, St Thomas Building, Brigade Rd, Ashok Nagar, Bengaluru, Karnataka 560025",19447599996,SKU_118,12-02-2023
Alfred Henderson,"32, Ground Floor, Gurudev Chambers, 7th Cross Rd, First Stage, Indiranagar, Bengaluru, Karnataka 560038",91436994393,SKU_27,11-02-2023
Tyler Rhinehart,"501 C.M.H Road Binnamangala Extension, Indira Nagar 1st Stage, Bengaluru, Karnataka 560038",17582775792,SKU_121,11-02-2023
James Albright,"Church St, Haridevpur, Shanthala Nagar, Ashok Nagar, Bengaluru, Karnataka 560001",84439860270,SKU_111,12-02-2023
Mary Callahan,"86, Church Street spencer building, Mahatma Gandhi Rd, Bengaluru, Karnataka 560001",25927508371,SKU_22,12-02-2023
Latia Baker,"15, Convent Rd, inside Green Theory, Shanthala Nagar, Ashok Nagar, Bengaluru, Karnataka 560025",78972790005,SKU_15,11-02-2023
Michael Moss,"52, 3rd floor, Above Pantaloons, M G Road, Bengaluru, Karnataka 560001",14190437534,SKU_6,11-02-2023
John Husseini,"Teacher's Colony, Jakkasandra, 1st Block Koramangala, HSR Layout 5th Sector, Bengaluru, Karnataka 560034",79461163274,SKU_16,13-02-2023
Kevin Stokes,"5th Floor, 541-543, 100 Feet Rd, Amarjyoti Layout, Bengaluru, Karnataka 560071",20883758819,SKU_25,11-02-2023
Chris Taylor,"421R, Shri Krishna Temple Rd, Indira Nagar 1st Stage, Stage 1, Indiranagar, Bengaluru, Karnataka 560038",28952271392,SKU_121,11-02-2023
Carol Burke,"44, Church St, Haridevpur, Shanthala Nagar, Ashok Nagar, Bengaluru, Karnataka 560001",40307533601,SKU_76,12-02-2023
Suzanne Gonzalez,"No. 30, Residency Road Brigade Road - Residency Road, Junction, Ashok Nagar, Bengaluru, Karnataka 560025",80767439974,SKU_63,11-02-2023
Katherine Holley,"138/2, Phase 2, R K Colony, 2nd Phase, J. P. Nagar, Bengaluru, Karnataka 560078",45195741417,SKU_93,13-02-2023
Ruth Daly,"4/1/1, Brunton Rd, Ashok Nagar, Bengaluru, Karnataka 560001",38531828049,SKU_24,11-02-2023
Edward Duncan,"1007, Mahatma Gandhi Rd, Yellappa Garden, Yellappa Chetty Layout, Sivanchetti Gardens, Bengaluru, Karnataka 560001",27841080733,SKU_49,11-02-2023
Laura Fisher,"No 657, 100 Feet Rd, above KTM Bike Show Room, Indiranagar, Bengaluru, Karnataka 560038",12606706591,SKU_28,12-02-2023
Billie Collins,"Ashok Nagar, Bengaluru, Karnataka 560025",56323110418,SKU_105,11-02-2023
Grady Linkous,"No 48, Triumph Tower, Opp High Gates Hotel, Church Street, Bengaluru, Karnataka 560001",12708948125,SKU_73,11-02-2023
Valerie Wilkerson,"7, Aaimata Temple Rd, KSFC Layout, Lingarajapuram, Bengaluru, Karnataka 560084",31455852314,SKU_14,11-02-2023
Christine Gordon,"3rd Floor, Garuda Mall, 15, Magrath Rd, Craig Park Layout, Ashok Nagar, Bengaluru, Karnataka 560025",18668546592,SKU_146,11-02-2023
James Mckinney,"Kannan Building, 89, Mahatma Gandhi Rd, Haridevpur, Shanthala Nagar, Ashok Nagar, Bengaluru, Karnataka 560001",35260035086,SKU_119,11-02-2023
Kenneth Pane,"14, The Park Hotel, 7, Mahatma Gandhi Rd, Yellappa Chetty Layout, Sivanchetti Gardens, Bengaluru, Karnataka 560042",74293612969,SKU_19,13-02-2023
Kathy Wiles,"No 148 & 149, St Thomas Building, Brigade Rd, Shanthala Nagar, Ashok Nagar, Karnataka 560025",18053936043,SKU_108,11-02-2023
Kathleen Utley,"Prince Arcade, 1066, 5th Cross Rd, HAL 2nd Stage, Doopanahalli, Indiranagar, Bengaluru, Karnataka 560008",22994045708,SKU_106,11-02-2023
William Croft,"472, Shri Krishna Temple Rd, Indira Nagar 1st Stage, Stage 1, Indiranagar, Bengaluru, Karnataka 560038",74670407413,SKU_19,12-02-2023
Robert Schulz,"70, Markham Road Off Brigade Road Next To Ocea Hotel, Ashok Nagar, Richmond Town, Bengaluru, Karnataka 560025",50247858301,SKU_48,11-02-2023
Gregory Wageman,"BDA Complex, No.17, Old Madras Rd, Indiranagar, Bengaluru, Karnataka 560038",99660758578,SKU_149,11-02-2023
Michael Singh,"101, Brigade Rd, Below ICP, Shanthala Nagar, Ashok Nagar, Bengaluru, Karnataka 560025",22506058837,SKU_61,11-02-2023
William Difranco,"XJHM+J8R, 17th F Cross Road, laksmipuram, Indiranagar, Bengaluru, Karnataka 560038",93392357196,SKU_101,11-02-2023
Jerry Barger,"22, Amoeba Complex, Church Street, Mahatma Gandhi Rd, Ashok Nagar, Bengaluru, Karnataka 560001",66034687235,SKU_115,11-02-2023
Martha Besser,"197/A, Paramahansa Yogananda Rd, next to Nagarjuna restaurent, opp. HDFC BANK, Stage 2, Eshwara Layout, Indiranagar, Bengaluru, Karnataka 560038",77214532455,SKU_112,12-02-2023
Gerald Smith,"6,ESI Hospital Road, 100 Feet Rd, HAL 2nd Stage, Doopanahalli, Bengaluru, Karnataka 560008",35554665228,SKU_148,12-02-2023
Marion Evenson,"179, 9th cross, 5th Main Rd, 1st Stage, Binnamangala, Hoysala Nagar, Indiranagar, Bengaluru, Karnataka 560038",33181533194,SKU_106,12-02-2023
Robert Nang,"6, Rest House Rd, Shanthala Nagar, Ashok Nagar, Bengaluru, Karnataka 560001",77001160535,SKU_45,12-02-2023
Joseph Canada,"XJG3+66F, Haridevpur, Shanthala Nagar, Ashok Nagar, Bengaluru, Karnataka 560001",24288580493,SKU_24,11-02-2023
Wayne Meyer,"NO.14, Ground Floor, Church Street, St Mark's Rd, Haridevpur, Shanthala Nagar, Ashok Nagar, Bengaluru, Karnataka 560001",99759583851,SKU_64,12-02-2023
Terry Robbins,"Door No, 58, 80 Feet Rd, HAL 3rd Stage, Main, Indiranagar, Bengaluru, Karnataka 560038",78169691180,SKU_49,12-02-2023
Darrell Carter,"7, Chinmaya Mission Hospital Rd, opp. Pillar No 77, Stage 2, Hoysala Nagar, Indiranagar, Bengaluru, Karnataka 560038",44906086311,SKU_87,12-02-2023
Kenneth Marshall,"70, Brigade Rd, Ashok Nagar, Bengaluru, Karnataka 560025",28190302012,SKU_123,11-02-2023
John Angeles,"29, Church St, Shanthala Nagar, Ashok Nagar, Bengaluru, Karnataka 560001",94035621477,SKU_146,11-02-2023
